[
  {
    "product_key": "prd_12v-actiontec-44",
    "name": "12V Actiontec - 44",
    "master_source": "kiotviet",
    "kiotviet_item_id": null,
    "legacy_detected_from": "warranty_items.csv"
  },
  {
    "product_key": "prd_16-ngu-n-actiontec",
    "name": "16 nguồn Actiontec",
    "master_source": "kiotviet",
    "kiotviet_item_id": null,
    "legacy_detected_from": "warranty_items.csv"
  },
  {
    "product_key": "prd_438-a22ep-g-v2-imou-kbt",
    "name": "438 - A22EP-G-V2-IMOU (KBT)",
    "master_source": "kiotviet",
    "kiotviet_item_id": null,
    "legacy_detected_from": "warranty_items.csv"
  },
  {
    "product_key": "prd_500gb-sg",
    "name": "500GB SG",
    "master_source": "kiotviet",
    "kiotviet_item_id": null,
    "legacy_detected_from": "warranty_items.csv"
  },
  {
    "product_key": "prd_7208hqhi-m1-e-hdd",
    "name": "7208HQHI-M1/E + HDD",
    "master_source": "kiotviet",
    "kiotviet_item_id": null,
    "legacy_detected_from": "warranty_items.csv"
  },
  {
    "product_key": "prd_a22ep",
    "name": "A22EP",
    "master_source": "kiotviet",
    "kiotviet_item_id": null,
    "legacy_detected_from": "warranty_items.csv"
  },
  {
    "product_key": "prd_a22ep-a",
    "name": "A22EP-A",
    "master_source": "kiotviet",
    "kiotviet_item_id": null,
    "legacy_detected_from": "warranty_items.csv"
  },
  {
    "product_key": "prd_a22ep-g",
    "name": "A22EP-G",
    "master_source": "kiotviet",
    "kiotviet_item_id": null,
    "legacy_detected_from": "warranty_items.csv"
  },
  {
    "product_key": "prd_a22ep-g-th-hikvision-64gb-en",
    "name": "A22EP-G + Thẻ Hikvision 64GB đen",
    "master_source": "kiotviet",
    "kiotviet_item_id": null,
    "legacy_detected_from": "warranty_items.csv"
  },
  {
    "product_key": "prd_a22ep-g-v2",
    "name": "A22EP-G-V2",
    "master_source": "kiotviet",
    "kiotviet_item_id": null,
    "legacy_detected_from": "warranty_items.csv"
  },
  {
    "product_key": "prd_a22ep-g-v2-imou-kbt",
    "name": "A22EP-G-V2-IMOU (KBT)",
    "master_source": "kiotviet",
    "kiotviet_item_id": null,
    "legacy_detected_from": "warranty_items.csv"
  },
  {
    "product_key": "prd_a22ep-l",
    "name": "A22EP-L",
    "master_source": "kiotviet",
    "kiotviet_item_id": null,
    "legacy_detected_from": "warranty_items.csv"
  },
  {
    "product_key": "prd_a22ep-l-sandisk-32gb",
    "name": "A22EP-L + Sandisk 32GB",
    "master_source": "kiotviet",
    "kiotviet_item_id": null,
    "legacy_detected_from": "warranty_items.csv"
  },
  {
    "product_key": "prd_a32ep",
    "name": "A32EP",
    "master_source": "kiotviet",
    "kiotviet_item_id": null,
    "legacy_detected_from": "warranty_items.csv"
  },
  {
    "product_key": "prd_a32ep-3mp",
    "name": "A32EP 3MP",
    "master_source": "kiotviet",
    "kiotviet_item_id": null,
    "legacy_detected_from": "warranty_items.csv"
  },
  {
    "product_key": "prd_a32ep-l",
    "name": "A32EP-L",
    "master_source": "kiotviet",
    "kiotviet_item_id": null,
    "legacy_detected_from": "warranty_items.csv"
  },
  {
    "product_key": "prd_a32ep-l-th-32gb-hikvision-en",
    "name": "A32EP-L + Thẻ 32GB HIKVISION ĐEN",
    "master_source": "kiotviet",
    "kiotviet_item_id": null,
    "legacy_detected_from": "warranty_items.csv"
  },
  {
    "product_key": "prd_a42p",
    "name": "A42P",
    "master_source": "kiotviet",
    "kiotviet_item_id": null,
    "legacy_detected_from": "warranty_items.csv"
  },
  {
    "product_key": "prd_a42p-d",
    "name": "A42P-D",
    "master_source": "kiotviet",
    "kiotviet_item_id": null,
    "legacy_detected_from": "warranty_items.csv"
  },
  {
    "product_key": "prd_a42p-d-v2-imou-kbt",
    "name": "A42P-D-V2-IMOU (KBT)",
    "master_source": "kiotviet",
    "kiotviet_item_id": null,
    "legacy_detected_from": "warranty_items.csv"
  },
  {
    "product_key": "prd_a42p-l",
    "name": "A42P-L",
    "master_source": "kiotviet",
    "kiotviet_item_id": null,
    "legacy_detected_from": "warranty_items.csv"
  },
  {
    "product_key": "prd_a42p-l-h-p",
    "name": "A42P-L + hộp",
    "master_source": "kiotviet",
    "kiotviet_item_id": null,
    "legacy_detected_from": "warranty_items.csv"
  },
  {
    "product_key": "prd_ae-dc5313-c6pro",
    "name": "AE-DC5313-C6PRO",
    "master_source": "kiotviet",
    "kiotviet_item_id": null,
    "legacy_detected_from": "warranty_items.csv"
  },
  {
    "product_key": "prd_acbel-12v-5a",
    "name": "Acbel 12V-5A",
    "master_source": "kiotviet",
    "kiotviet_item_id": null,
    "legacy_detected_from": "warranty_items.csv"
  },
  {
    "product_key": "prd_actiontec-12v-2a",
    "name": "Actiontec 12V-2A",
    "master_source": "kiotviet",
    "kiotviet_item_id": null,
    "legacy_detected_from": "warranty_items.csv"
  },
  {
    "product_key": "prd_adapter-12v-5a",
    "name": "Adapter 12V-5A",
    "master_source": "kiotviet",
    "kiotviet_item_id": null,
    "legacy_detected_from": "warranty_items.csv"
  },
  {
    "product_key": "prd_b1a21p",
    "name": "B1A21P",
    "master_source": "kiotviet",
    "kiotviet_item_id": null,
    "legacy_detected_from": "warranty_items.csv"
  },
  {
    "product_key": "prd_b1a21p-vn",
    "name": "B1A21P-VN",
    "master_source": "kiotviet",
    "kiotviet_item_id": null,
    "legacy_detected_from": "warranty_items.csv"
  },
  {
    "product_key": "prd_b2a21p",
    "name": "B2A21P",
    "master_source": "kiotviet",
    "kiotviet_item_id": null,
    "legacy_detected_from": "warranty_items.csv"
  },
  {
    "product_key": "prd_b32p-v2",
    "name": "B32P-V2",
    "master_source": "kiotviet",
    "kiotviet_item_id": null,
    "legacy_detected_from": "warranty_items.csv"
  },
  {
    "product_key": "prd_bnc-f5-30c",
    "name": "BNC F5 30c",
    "master_source": "kiotviet",
    "kiotviet_item_id": null,
    "legacy_detected_from": "warranty_items.csv"
  },
  {
    "product_key": "prd_bt-950gs-20b",
    "name": "BT-950GS-20B",
    "master_source": "kiotviet",
    "kiotviet_item_id": null,
    "legacy_detected_from": "warranty_items.csv"
  },
  {
    "product_key": "prd_bt-950sm-25a",
    "name": "BT-950SM-25A",
    "master_source": "kiotviet",
    "kiotviet_item_id": null,
    "legacy_detected_from": "warranty_items.csv"
  },
  {
    "product_key": "prd_bt-950sm-25b",
    "name": "BT-950SM-25B",
    "master_source": "kiotviet",
    "kiotviet_item_id": null,
    "legacy_detected_from": "warranty_items.csv"
  },
  {
    "product_key": "prd_bt950-gs20-converter-2-s-i-quang-1000m-8-c-i",
    "name": "BT950 GS20 - Converter 2 sợi quang - 1000M - 8 cái",
    "master_source": "kiotviet",
    "kiotviet_item_id": null,
    "legacy_detected_from": "warranty_items.csv"
  },
  {
    "product_key": "prd_bt950-sm25-converter-2-s-i-quang-100m-8-c-i",
    "name": "BT950 SM25 - Converter 2 sợi quang 100M - 8 cái",
    "master_source": "kiotviet",
    "kiotviet_item_id": null,
    "legacy_detected_from": "warranty_items.csv"
  },
  {
    "product_key": "prd_bt950-sm25a-converter-1-s-i-quang-100m",
    "name": "BT950 SM25A - Converter 1 sợi quang - 100M",
    "master_source": "kiotviet",
    "kiotviet_item_id": null,
    "legacy_detected_from": "warranty_items.csv"
  },
  {
    "product_key": "prd_bt950-sm25b-converter-1-s-i-quang-100m",
    "name": "BT950 SM25B - Converter 1 sợi quang - 100M",
    "master_source": "kiotviet",
    "kiotviet_item_id": null,
    "legacy_detected_from": "warranty_items.csv"
  },
  {
    "product_key": "prd_balun-1080p-xanh-6",
    "name": "Balun 1080P Xanh (6)",
    "master_source": "kiotviet",
    "kiotviet_item_id": null,
    "legacy_detected_from": "warranty_items.csv"
  },
  {
    "product_key": "prd_balun-5mp-ch-t-5-b",
    "name": "Balun 5MP Chốt đỏ  - 5 bộ",
    "master_source": "kiotviet",
    "kiotviet_item_id": null,
    "legacy_detected_from": "warranty_items.csv"
  },
  {
    "product_key": "prd_balun-5mp-ch-t-11-b",
    "name": "Balun 5MP Chốt đỏ (11 bộ)",
    "master_source": "kiotviet",
    "kiotviet_item_id": null,
    "legacy_detected_from": "warranty_items.csv"
  },
  {
    "product_key": "prd_balun-5mp-ch-t-t-t-12",
    "name": "Balun 5MP Chốt đỏ - tốt  (12)",
    "master_source": "kiotviet",
    "kiotviet_item_id": null,
    "legacy_detected_from": "warranty_items.csv"
  },
  {
    "product_key": "prd_balun-5mp-ch-t-t-t-12-b",
    "name": "Balun 5MP Chốt đỏ - tốt (12 bộ)",
    "master_source": "kiotviet",
    "kiotviet_item_id": null,
    "legacy_detected_from": "warranty_items.csv"
  },
  {
    "product_key": "prd_balun-5mp-ch-t-t-t-b",
    "name": "Balun 5MP Chốt đỏ - tốt (Bộ)",
    "master_source": "kiotviet",
    "kiotviet_item_id": null,
    "legacy_detected_from": "warranty_items.csv"
  },
  {
    "product_key": "prd_balun-ch-t-21-ang-g-i-cnm-18-b",
    "name": "Balun chốt đỏ - 21 (đang gởi CNM: 18 bộ)",
    "master_source": "kiotviet",
    "kiotviet_item_id": null,
    "legacy_detected_from": "warranty_items.csv"
  },
  {
    "product_key": "prd_balun-ch-t-3-b",
    "name": "Balun chốt đỏ - 3 bộ",
    "master_source": "kiotviet",
    "kiotviet_item_id": null,
    "legacy_detected_from": "warranty_items.csv"
  },
  {
    "product_key": "prd_balun-ch-t-4-b",
    "name": "Balun chốt đỏ - 4 bộ",
    "master_source": "kiotviet",
    "kiotviet_item_id": null,
    "legacy_detected_from": "warranty_items.csv"
  },
  {
    "product_key": "prd_balun-ch-t-4-b-2-v",
    "name": "Balun chốt đỏ - 4 bộ (2 vỏ)",
    "master_source": "kiotviet",
    "kiotviet_item_id": null,
    "legacy_detected_from": "warranty_items.csv"
  },
  {
    "product_key": "prd_balun-ch-t-6",
    "name": "Balun chốt đỏ - 6",
    "master_source": "kiotviet",
    "kiotviet_item_id": null,
    "legacy_detected_from": "warranty_items.csv"
  },
  {
    "product_key": "prd_balun-ch-t-7-b",
    "name": "Balun chốt đỏ - 7 bộ",
    "master_source": "kiotviet",
    "kiotviet_item_id": null,
    "legacy_detected_from": "warranty_items.csv"
  },
  {
    "product_key": "prd_balun-ch-t-8-b",
    "name": "Balun chốt đỏ - 8 bộ",